{
  "name": "sample",
  "description": "test",
  "output_freq": 600,
  "options": {
    "csvOutput": true,
    "sensation_adaptation": false,
    "sensation_coredTdt": false
  },
  "bodybuilder": {
    "height": 0.92,
    "weight": 37.43,
    "age": 25,
    "gender": "male",
    "body_fat": 0.15
  },
  "phases": [
    {
      "start_time": 0,
      "time_units": "minutes",
      "ramp": false,
      "end_time": 60,
      "met_activity_name": "Seated",
      "met": 1.0,
      "default_data": {
        "rh": 0.5,
        "v": 0.20,
        "solar": 0.000,
        "ta": 22.0,
        "mrt": 22.0
      },
      "clo_ensemble_name": "CATARC_Winter_1"
    },
    {
      "start_time": 60,
      "end_time": 120,
      "time_units": "minutes",
      "default_data": {
        "rh": 0.5,
        "v": 0.2,
        "solar": 0.000,
        "ta": 22.000,
        "mrt": 22.000
      },
      "segment_data": {
        "Head": {
          "mrt": 20.0,
          "rh": 0.5,
          "solar": 0,
          "ta": 20,
          "v": 0.25
        }
      },
      "ramp": false,
      "met_activity_name": "Seated",
      "met": 1.0,
      "clo_ensemble_name": "CATARC_Winter_1"
    }

  ]
}
